{
    "configuracion": {
        "ancho": 10,
        "alto": 5
    },
    "conexiones_horizontales": [],
    "conexiones_verticales": [],
    "agentesspawn": [],
    "espacios_navegables": {},
    "muros": [
        {
            "id": "Muro_exterior_1_part0",
            "tipo": "muro_exterior",
            "poligono": [
                [
                    9.5,
                    -0.3
                ],
                [
                    9.5,
                    -0.7
                ],
                [
                    -0.5,
                    -0.7
                ],
                [
                    -0.5,
                    -0.3
                ]
            ]
        },
        {
            "id": "Muro_exterior_2_part0",
            "tipo": "muro_exterior",
            "poligono": [
                [
                    9.3,
                    4.5
                ],
                [
                    9.7,
                    4.5
                ],
                [
                    9.7,
                    -0.5
                ],
                [
                    9.3,
                    -0.5
                ]
            ]
        },
        {
            "id": "Muro_exterior_3_part0",
            "tipo": "muro_exterior",
            "poligono": [
                [
                    -0.5,
                    4.3
                ],
                [
                    -0.5,
                    4.7
                ],
                [
                    9.5,
                    4.7
                ],
                [
                    9.5,
                    4.3
                ]
            ]
        },
        {
            "id": "Muro_exterior_4_part0",
            "tipo": "muro_exterior",
            "poligono": [
                [
                    -0.3,
                    -0.5
                ],
                [
                    -0.7,
                    -0.5
                ],
                [
                    -0.7,
                    4.5
                ],
                [
                    -0.3,
                    4.5
                ]
            ]
        },
        {
            "id": "Muro_exterior_5_part0",
            "tipo": "muro_exterior",
            "poligono": [
                [
                    4.3,
                    4.5
                ],
                [
                    4.7,
                    4.5
                ],
                [
                    4.7,
                    -0.5
                ],
                [
                    4.3,
                    -0.5
                ]
            ]
        },
        {
            "id": "Muro_exterior_6_part0",
            "tipo": "muro_exterior",
            "poligono": [
                [
                    5.2,
                    1.5
                ],
                [
                    4.8,
                    1.5
                ],
                [
                    4.8,
                    2.5
                ],
                [
                    5.2,
                    2.5
                ]
            ]
        },
        {
            "id": "Muro_exterior_7_part0",
            "tipo": "muro_exterior",
            "poligono": [
                [
                    4.8,
                    2.0
                ],
                [
                    5.2,
                    2.0
                ],
                [
                    5.2,
                    1.5
                ],
                [
                    4.8,
                    1.5
                ]
            ]
        },
        {
            "id": "Muro_exterior_8_part0",
            "tipo": "muro_exterior",
            "poligono": [
                [
                    5.5,
                    2.2
                ],
                [
                    5.5,
                    1.8
                ],
                [
                    5.0,
                    1.8
                ],
                [
                    5.0,
                    2.2
                ]
            ]
        },
        {
            "id": "Muro_exterior_9_part0",
            "tipo": "muro_exterior",
            "poligono": [
                [
                    6.5,
                    2.2
                ],
                [
                    6.5,
                    1.8
                ],
                [
                    5.5,
                    1.8
                ],
                [
                    5.5,
                    2.2
                ]
            ]
        },
        {
            "id": "Muro_exterior_10_part0",
            "tipo": "muro_exterior",
            "poligono": [
                [
                    6.7,
                    1.5
                ],
                [
                    6.3,
                    1.5
                ],
                [
                    6.3,
                    2.0
                ],
                [
                    6.7,
                    2.0
                ]
            ]
        }
    ]
}